{
  "apiVersion": "platform.4so.io/v1alpha1",
  "kind": "PlatformComponent",
  "metadata": {
    "name": "external-secrets"
  },
  "spec": {
    "capabilities": [
      "secret-references"
    ],
    "category": "security",
    "certification": {
      "evidenceDigest": "",
      "profiles": [],
      "status": "candidate"
    },
    "compatibility": {
      "architectures": [
        "amd64",
        "arm64"
      ],
      "distributionProfiles": [
        "kubernetes",
        "rke2"
      ],
      "kubernetes": {
        "maxVersion": "1.35",
        "minVersion": "1.34"
      },
      "providers": [
        "imported",
        "cluster-api-topology-v1beta2"
      ]
    },
    "conflictsWith": [],
    "delivery": {
      "chart": "external-secrets",
      "repositoryKey": "platform-charts",
      "type": "helm"
    },
    "dependencies": [
      "argocd"
    ],
    "displayName": "External Secrets",
    "evidenceRequired": [
      "resolved-source-lock",
      "rendered-resource-inventory",
      "policy-result",
      "runtime-readiness",
      "rollback-verification"
    ],
    "exclusiveCapabilities": [
      "secret-sync-controller"
    ],
    "mandatory": true,
    "namespace": "external-secrets",
    "operations": {
      "install": "required",
      "preflight": "required",
      "rollback": "required",
      "uninstall": "safe-when-supported",
      "upgrade": "required",
      "verify": "required"
    },
    "provides": [
      "secret-sync-controller"
    ],
    "readiness": [
      "deployment/external-secrets"
    ],
    "release": "2.8.0",
    "requiresCapabilities": [],
    "risk": "high",
    "rollback": {
      "strategy": "restore-previous-release-with-secret-objects-preserved"
    },
    "settingsSchemaRef": "schemas/settings/external-secrets.schema.json",
    "source": {
      "artifactDigest": "",
      "imageInventoryDigest": "",
      "licenseManifestDigest": "",
      "provenance": "required",
      "resolved": false,
      "sbom": "required",
      "signatureVerification": "required",
      "sourceLockDigest": "",
      "type": "helm-chart"
    },
    "supportTier": "research-candidate",
    "versionPolicy": "exact-upstream-admitted-pending-source-acquisition",
    "wave": 28
  }
}
