{
  "apiVersion": "platform.4so.io/v1alpha1",
  "kind": "PlatformComponent",
  "metadata": {
    "name": "alloy"
  },
  "spec": {
    "capabilities": [
      "telemetry-collection"
    ],
    "category": "observability",
    "certification": {
      "evidenceDigest": "",
      "profiles": [],
      "status": "candidate"
    },
    "compatibility": {
      "architectures": [
        "amd64",
        "arm64"
      ],
      "distributionProfiles": [
        "kubernetes",
        "rke2"
      ],
      "kubernetes": {
        "maxVersion": "1.35",
        "minVersion": "1.34"
      },
      "providers": [
        "imported",
        "cluster-api-topology-v1beta2"
      ]
    },
    "conflictsWith": [],
    "delivery": {
      "chart": "alloy",
      "repositoryKey": "platform-charts",
      "type": "helm"
    },
    "dependencies": [
      "loki"
    ],
    "displayName": "Grafana Alloy",
    "evidenceRequired": [
      "resolved-source-lock",
      "rendered-resource-inventory",
      "policy-result",
      "runtime-readiness",
      "rollback-verification"
    ],
    "exclusiveCapabilities": [],
    "mandatory": true,
    "namespace": "logging",
    "operations": {
      "install": "required",
      "preflight": "required",
      "rollback": "required",
      "uninstall": "safe-when-supported",
      "upgrade": "required",
      "verify": "required"
    },
    "provides": [
      "telemetry-agent"
    ],
    "readiness": [
      "daemonset/alloy"
    ],
    "release": "1.11.0",
    "requiresCapabilities": [
      "logs-backend"
    ],
    "risk": "medium",
    "rollback": {
      "strategy": "restore-previous-collector-config"
    },
    "settingsSchemaRef": "schemas/settings/alloy.schema.json",
    "source": {
      "artifactDigest": "",
      "imageInventoryDigest": "",
      "licenseManifestDigest": "",
      "provenance": "required",
      "resolved": false,
      "sbom": "required",
      "signatureVerification": "required",
      "sourceLockDigest": "",
      "type": "helm-chart"
    },
    "supportTier": "research-candidate",
    "versionPolicy": "exact-upstream-admitted-pending-source-acquisition",
    "wave": 69
  }
}
