{
  "apiVersion": "platform.4so.io/v1alpha1",
  "kind": "PlatformComponent",
  "metadata": {
    "name": "gateway-api"
  },
  "spec": {
    "displayName": "Gateway API",
    "category": "traffic",
    "release": "1.6.1",
    "versionPolicy": "exact-offline-import",
    "supportTier": "research-candidate",
    "mandatory": true,
    "dependencies": [
      "argocd"
    ],
    "provides": [
      "gateway-api-crds"
    ],
    "requiresCapabilities": [],
    "exclusiveCapabilities": [],
    "conflictsWith": [],
    "risk": "medium",
    "capabilities": [
      "gateway-api"
    ],
    "namespace": "platform-system",
    "wave": 20,
    "settingsSchemaRef": "schemas/settings/gateway-api.schema.json",
    "compatibility": {
      "kubernetes": {
        "minVersion": "1.34",
        "maxVersion": "1.35"
      },
      "architectures": [
        "amd64",
        "arm64"
      ],
      "distributionProfiles": [
        "kubernetes",
        "rke2"
      ],
      "providers": [
        "imported",
        "cluster-api-topology-v1beta2"
      ]
    },
    "delivery": {
      "type": "native-manifest",
      "repositoryKey": "offline-catalog-bundle",
      "chart": "gateway-api/1.5.1"
    },
    "source": {
      "type": "external-tagged-source-set",
      "resolved": true,
      "bundleKey": "gateway-api/1.6.1",
      "artifactDigest": "sha256:73948c4ac0f3aa09d542334261e919ed08162302ba5ae5eb5c86fbc44fe51d9e",
      "renderManifestDigest": "sha256:7f72c399cdf40c6bc0bb5d12ca9c6f89fef22f0bd3334823e06f1c804166ad95",
      "sourceLockDigest": "sha256:96a24877bfb695bd1bb12f379c60d93209c36e641747f79c24f56e01c7120677",
      "imageInventoryDigest": "sha256:f9cf52bb037434a9aa098e11a18fd12587bad51bf07928db10899b1da952a2ac",
      "licenseManifestDigest": "sha256:6bf112cdd891d4e70058b8f28b2fd4a26d9c5548c9f8f397691c9532ddf797dc",
      "signatureVerification": "sha256-pinned-offline",
      "sbom": "sha256:aad25ad6db1068ffb3b45abcd345d95944baefcbd60c928efdbfbc6de979f433",
      "provenance": "sha256:d755dbbc42d08baaf0af0740f9dbf147a6dea9475322ea2f4de1401e8e6afbb7"
    },
    "operations": {
      "install": "required",
      "preflight": "required",
      "rollback": "required",
      "uninstall": "safe-when-supported",
      "upgrade": "required",
      "verify": "required"
    },
    "readiness": [
      "crd/gateways.gateway.networking.k8s.io"
    ],
    "rollback": {
      "strategy": "remove-only-when-no-consumers"
    },
    "evidenceRequired": [
      "resolved-source-lock",
      "rendered-resource-inventory",
      "policy-result",
      "runtime-readiness",
      "rollback-verification"
    ],
    "certification": {
      "status": "candidate",
      "profiles": null,
      "evidenceDigest": ""
    }
  }
}
