{
  "apiVersion": "platform.4so.io/v1alpha1",
  "kind": "PlatformComponent",
  "metadata": {
    "name": "cilium"
  },
  "spec": {
    "displayName": "Cilium",
    "category": "networking",
    "release": "1.20.1",
    "versionPolicy": "exact-offline-import",
    "supportTier": "research-candidate",
    "mandatory": true,
    "dependencies": [],
    "provides": [
      "cni",
      "network-policy-engine",
      "network-observability"
    ],
    "requiresCapabilities": [],
    "exclusiveCapabilities": [
      "cni"
    ],
    "conflictsWith": [],
    "risk": "critical",
    "capabilities": [
      "cni",
      "network-policy",
      "hubble"
    ],
    "namespace": "kube-system",
    "wave": 5,
    "settingsSchemaRef": "schemas/settings/cilium.schema.json",
    "compatibility": {
      "kubernetes": {
        "minVersion": "1.34",
        "maxVersion": "1.35"
      },
      "architectures": [
        "amd64",
        "arm64"
      ],
      "distributionProfiles": [
        "kubernetes",
        "rke2"
      ],
      "providers": [
        "imported",
        "cluster-api-topology-v1beta2"
      ]
    },
    "delivery": {
      "type": "helm",
      "repositoryKey": "offline-catalog-bundle",
      "chart": "cilium"
    },
    "source": {
      "type": "helm-chart",
      "resolved": true,
      "bundleKey": "cilium/1.20.1",
      "artifactDigest": "sha256:06210eef7c23d15f7699c79e2fe3a1ec9c389024c5c5c006ea04022d322449a2",
      "renderManifestDigest": "sha256:f3561742c0ef2b171b37ffec20e68f73f5498a79402fee29440cd7f8f61f9cd3",
      "sourceLockDigest": "sha256:f422377a963a11f71e9158d91238d85415243f84841b153eee78f704bfedf40a",
      "imageInventoryDigest": "sha256:78ebc3f3441d8e1e8facfd726bbc6350fcf7eed4d088b5cf7ddb4d07e2a6a222",
      "licenseManifestDigest": "sha256:1a2910e2528d912098ca06333231b242b362202e3f7312f4c1a93c0dc308b6a6",
      "signatureVerification": "sha256-pinned-offline",
      "sbom": "sha256:b3f6b5fc8300359e0cc5a6a5d5448596c352c5d67c151a3cea18e25fde9e485d",
      "provenance": "sha256:f1a75738d82cd88d67d8793dc1e6e5baa3c1dd31c10374d2831f223a7a549cbd"
    },
    "operations": {
      "install": "required",
      "preflight": "required",
      "rollback": "required",
      "uninstall": "safe-when-supported",
      "upgrade": "required",
      "verify": "required"
    },
    "readiness": [
      "daemonset/cilium",
      "deployment/cilium-operator"
    ],
    "rollback": {
      "strategy": "provider-specific-cni-rollback"
    },
    "evidenceRequired": [
      "resolved-source-lock",
      "rendered-resource-inventory",
      "policy-result",
      "runtime-readiness",
      "rollback-verification"
    ],
    "certification": {
      "status": "candidate",
      "profiles": null,
      "evidenceDigest": ""
    }
  }
}
