{
  "apiVersion": "platform.4so.io/v1alpha1",
  "kind": "PlatformComponent",
  "metadata": {
    "name": "tetragon"
  },
  "spec": {
    "displayName": "Tetragon",
    "category": "security",
    "release": "1.7.0",
    "versionPolicy": "exact-offline-import",
    "supportTier": "research-candidate",
    "mandatory": false,
    "dependencies": [
      "cilium"
    ],
    "provides": [
      "runtime-security-agent"
    ],
    "requiresCapabilities": [],
    "exclusiveCapabilities": [],
    "conflictsWith": [],
    "risk": "medium",
    "capabilities": [
      "runtime-observability"
    ],
    "namespace": "tetragon",
    "wave": 45,
    "settingsSchemaRef": "schemas/settings/tetragon.schema.json",
    "compatibility": {
      "kubernetes": {
        "minVersion": "1.34",
        "maxVersion": "1.35"
      },
      "architectures": [
        "amd64",
        "arm64"
      ],
      "distributionProfiles": [
        "kubernetes",
        "rke2"
      ],
      "providers": [
        "imported",
        "cluster-api-topology-v1beta2"
      ]
    },
    "delivery": {
      "type": "helm",
      "repositoryKey": "offline-catalog-bundle",
      "chart": "tetragon"
    },
    "source": {
      "type": "helm-chart",
      "resolved": true,
      "bundleKey": "tetragon/1.7.0",
      "artifactDigest": "sha256:2d142ecff37a05bc2efab4c3f90cac2a545e8951d845fd15d023e1cbc31685f5",
      "renderManifestDigest": "sha256:58d4adc7fe9404478c97a5b31663c81c449ede338710f66b11e17f1d6428c1e6",
      "sourceLockDigest": "sha256:3fb6e6b100a43dcbcaf1cdaaee5f58ef923188ce8ed54e9a5329974e9a2c60d7",
      "imageInventoryDigest": "sha256:3cd1b145e4113bfbd504177a6f1cd14892bf6ad0c85503517010ac314f4a242d",
      "licenseManifestDigest": "sha256:43a4e372b4bcde815f517cedbe80f9d86a8dddc3f6563652990c5acf3b3a3018",
      "signatureVerification": "sha256-pinned-offline",
      "sbom": "sha256:ca76b776774c130fc4c1a811ad98ef4728bf50842afdccdbf2d2342dd57aaa01",
      "provenance": "sha256:c5dcde611d1837d62201103a7509e8d5ab2f1aaa8941c2b22faa1fcc9b3c286f"
    },
    "operations": {
      "install": "required",
      "preflight": "required",
      "rollback": "required",
      "uninstall": "safe-when-supported",
      "upgrade": "required",
      "verify": "required"
    },
    "readiness": [
      "daemonset/tetragon"
    ],
    "rollback": {
      "strategy": "restore-previous-release"
    },
    "evidenceRequired": [
      "resolved-source-lock",
      "rendered-resource-inventory",
      "policy-result",
      "runtime-readiness",
      "rollback-verification"
    ],
    "certification": {
      "status": "candidate",
      "profiles": null,
      "evidenceDigest": ""
    }
  }
}
